"corpus","filename","utterance_id","clause_no","speaker","clause","comments","matrix_lg","linguality","dv","aoa_min","aoa_maj","moth_lg","fath_lg","parental","primary_lg","secondary_lg","educ_lg","identity","contact1","contact2","contact3","contact4","contact5","soc_net"
"Siarad","fusser17",1211,1,"AET","ond mi wnaethon nhw diflannu mor sudden","clause division","cym","monoW","ww",3,1,3,3,3,2,2,2,1,1,1,4,1,4,2.2
"Siarad","fusser17",1211,1,"AET","â ddothon nhw","h","cym","monoW","ww",3,1,3,3,3,2,2,2,1,1,1,4,1,4,2.2
"Siarad","fusser17",1212,1,"BEN","yeah na mae yn hyfryd yeah yeah",,"cym","monoW","ww",5,1,3,3,3,3,3,3,3,4,4,4,4,4,4
"Siarad","fusser17",1213,1,"AET","oedd",,"cym","monoW","ww",3,1,3,3,3,2,2,2,1,1,1,4,1,4,2.2
"Siarad","fusser17",1213,2,"AET","oedd o yn odd i fod yn honest",,"cym","monoW","ww",3,1,3,3,3,2,2,2,1,1,1,4,1,4,2.2
"Siarad","fusser17",1222,1,"BEN","er er mae pethau yn digwydd",,"cym","monoW","ww",5,1,3,3,3,3,3,3,3,4,4,4,4,4,4
"Siarad","fusser17",1223,1,"BEN","mae action yno",,"cym","monoW","ww",5,1,3,3,3,3,3,3,3,4,4,4,4,4,4
"Siarad","fusser17",1224,1,"AET","yndy",,"cym","monoW","ww",3,1,3,3,3,2,2,2,1,1,1,4,1,4,2.2
"Siarad","fusser17",1225,1,"BEN","er mae haul disgleirio ar y ar y y algae neu stuff gwyrdd ar y ar y cerrig",,"cym","monoW","ww",5,1,3,3,3,3,3,3,3,4,4,4,4,4,4
"Siarad","fusser17",1227,1,"BEN","um mae dŵr yn redeg",,"cym","monoW","ww",5,1,3,3,3,3,3,3,3,4,4,4,4,4,4
"Siarad","fusser17",1228,1,"BEN","dach chi yn cael y wahaniaeth rhwng y y top",,"cym","monoW","ww",5,1,3,3,3,3,3,3,3,4,4,4,4,4,4
"Siarad","fusser17",1228,2,"BEN","lle mae bob_dim fel gwallt",,"cym","monoW","ww",5,1,3,3,3,3,3,3,3,4,4,4,4,4,4
"Siarad","fusser17",1234,1,"AET","mae o","x","cym","monoW","ww",3,1,3,3,3,2,2,2,1,1,1,4,1,4,2.2
"Siarad","fusser17",1236,1,"AET","mae o ddiwrnod",,"cym","monoW","ww",3,1,3,3,3,2,2,2,1,1,1,4,1,4,2.2
"Siarad","fusser17",1236,2,"AET","lle dach chi roid eich botel pop yn y dŵr i oeri","clause division","cym","monoW","ww",3,1,3,3,3,2,2,2,1,1,1,4,1,4,2.2
"Siarad","fusser17",1236,3,"AET","roid eich botel pop yn y dŵr","q","cym","monoW","ww",3,1,3,3,3,2,2,2,1,1,1,4,1,4,2.2
"Siarad","fusser17",1236,4,"AET","i oeri","q","cym","monoW","ww",3,1,3,3,3,2,2,2,1,1,1,4,1,4,2.2
"Siarad","fusser17",1239,1,"AET","a dach chi yn eistedd i edrych","clause division","cym","monoW","ww",3,1,3,3,3,2,2,2,1,1,1,4,1,4,2.2
"Siarad","fusser17",1239,2,"AET","edrych","q","cym","monoW","ww",3,1,3,3,3,2,2,2,1,1,1,4,1,4,2.2
"Siarad","fusser17",1250,1,"AET","dydy o ddim_byd debyg",,"cym","monoW","ww",3,1,3,3,3,2,2,2,1,1,1,4,1,4,2.2
"Siarad","fusser18",245,1,"BEU","yeah dw meddwl deuddeg","clause division","cym","monoW","ww",1,1,1,1,1,3,2,2.5,1,1,1,1,4,4,2.2
"Siarad","fusser18",245,1,"BEU","gei di yeah","h","cym","monoW","ww",1,1,1,1,1,3,2,2.5,1,1,1,1,4,4,2.2
"Siarad","fusser18",248,1,"BEU","ond um dw i ddim isio dim mwy o rheina",,"cym","monoW","ww",1,1,1,1,1,3,2,2.5,1,1,1,1,4,4,2.2
"Siarad","fusser18",253,1,"BEU","ond chwarae teg dw i right ofalus hefyd",,"cym","monoW","ww",1,1,1,1,1,3,2,2.5,1,1,1,1,4,4,2.2
"Siarad","fusser18",253,2,"BEU","yndw",,"cym","monoW","ww",1,1,1,1,1,3,2,2.5,1,1,1,1,4,4,2.2
"Siarad","fusser18",253,3,"BEU","pan dw i mynd i llefydd yma",,"cym","monoW","ww",1,1,1,1,1,3,2,2.5,1,1,1,1,4,4,2.2
"Siarad","fusser18",260,1,"BEU","wnes i ddim gweld dim_byd chwaith",,"cym","monoW","ww",1,1,1,1,1,3,2,2.5,1,1,1,1,4,4,2.2
"Siarad","fusser18",261,1,"ARD","well dw i rŵan yn defnyddio yr limiter ar y nghar i i wneud yn sure cyrraedd rhan tri_deg wan",,"cym","biling","wb",0,3,1,1,1,1,3,2,1,1,1,1,1,1,1
"Siarad","fusser18",261,2,"ARD","i wneud yn sure","q","cym","monoW","ww",0,3,1,1,1,1,3,2,1,1,1,1,1,1,1
"Siarad","fusser18",261,3,"ARD","cyrraedd rhan tri_deg wan","q","cym","monoW","ww",0,3,1,1,1,1,3,2,1,1,1,1,1,1,1
"Siarad","fusser18",261,4,"ARD","bod fi","x","cym","monoW","ww",0,3,1,1,1,1,3,2,1,1,1,1,1,1,1
"Siarad","fusser18",262,1,"BEU","yeah mae gyn ti limiter ar un chdi",,"cym","biling","wb",1,1,1,1,1,3,2,2.5,1,1,1,1,4,4,2.2
"Siarad","fusser18",262,2,"BEU","does yeah","x","cym","monoW","ww",1,1,1,1,1,3,2,2.5,1,1,1,1,4,4,2.2
"Siarad","fusser18",263,1,"ARD","oes limiter",,"cym","biling","wb",0,3,1,1,1,1,3,2,1,1,1,1,1,1,1
"Siarad","fusser18",264,1,"ARD","a dw i roid o ar dri_deg","clause division","cym","monoW","ww",0,3,1,1,1,1,3,2,1,1,1,1,1,1,1
"Siarad","fusser18",264,2,"ARD","roid o ar dri_deg","q","cym","monoW","ww",0,3,1,1,1,1,3,2,1,1,1,1,1,1,1
"Siarad","fusser18",266,1,"ARD","ond um mae o yn annifyr weithiau",,"cym","monoW","ww",0,3,1,1,1,1,3,2,1,1,1,1,1,1,1
"Siarad","fusser18",267,1,"ARD","achos mae yna geir tu ôl yn ysu heibio",,"cym","monoW","ww",0,3,1,1,1,1,3,2,1,1,1,1,1,1,1
"Siarad","fusser18",270,1,"BEU","ac ac oedd o meddwl bod yna lorry o ei flaen o",,"cym","monoW","ww",1,1,1,1,1,3,2,2.5,1,1,1,1,4,4,2.2
"Siarad","fusser18",270,2,"BEU","bod yna lorry o ei flaen o","q","cym","monoW","ww",1,1,1,1,1,3,2,2.5,1,1,1,1,4,4,2.2
"Siarad","fusser18",271,1,"BEU","wnaeth o ddim gweld y sign tri_deg",,"cym","monoW","ww",1,1,1,1,1,3,2,2.5,1,1,1,1,4,4,2.2
"Siarad","fusser18",272,1,"BEU","so pan wnaeth o dod i_fewn iddo fo",,"cym","monoW","ww",1,1,1,1,1,3,2,2.5,1,1,1,1,4,4,2.2
"Siarad","fusser18",272,2,"BEU","oedd o gorod brecio yn sydyn i_lawr",,"cym","monoW","ww",1,1,1,1,1,3,2,2.5,1,1,1,1,4,4,2.2
"Siarad","fusser18",273,1,"BEU","ond erbyn adeg yna oedd o wedi cael",,"cym","monoW","ww",1,1,1,1,1,3,2,2.5,1,1,1,1,4,4,2.2
"Siarad","fusser18",273,2,"BEU","ei cael","x","cym","monoW","ww",1,1,1,1,1,3,2,2.5,1,1,1,1,4,4,2.2
"Siarad","fusser18",273,3,"BEU","ei ddal","x","cym","monoW","ww",1,1,1,1,1,3,2,2.5,1,1,1,1,4,4,2.2
"Siarad","fusser18",275,1,"BEU","because oedd","x","cym","biling","wb",1,1,1,1,1,3,2,2.5,1,1,1,1,4,4,2.2
"Siarad","fusser18",275,2,"BEU","oedd","x","cym","monoW","ww",1,1,1,1,1,3,2,2.5,1,1,1,1,4,4,2.2
"Siarad","fusser18",275,3,"BEU","oedd y camera rywbeth fath â hanner can llath i_fewn i yr thing tri_deg er tri_deg yna",,"cym","biling","wb",1,1,1,1,1,3,2,2.5,1,1,1,1,4,4,2.2
"Siarad","fusser18",275,4,"BEU","timod","x","cym","monoW","ww",1,1,1,1,1,3,2,2.5,1,1,1,1,4,4,2.2
"Siarad","fusser18",284,1,"ARD","oh mae isio bod yn ofalus felly yn_does efo er gyrru",,"cym","monoW","ww",0,3,1,1,1,1,3,2,1,1,1,1,1,1,1
"Siarad","fusser18",302,1,"ARD","oh dw i sure",,"cym","monoW","ww",0,3,1,1,1,1,3,2,1,1,1,1,1,1,1
"Siarad","fusser18",311,1,"ARD","basai wedi gwneud i brynu present i Haf",,"cym","monoW","ww",0,3,1,1,1,1,3,2,1,1,1,1,1,1,1
"Siarad","fusser18",311,2,"ARD","i brynu present i Haf","q","cym","monoW","ww",0,3,1,1,1,1,3,2,1,1,1,1,1,1,1
"Siarad","fusser18",315,1,"ARD","oh well mae yn gofyn dysgu o hynna felly yn_dydy",,"cym","monoW","ww",0,3,1,1,1,1,3,2,1,1,1,1,1,1,1
"Siarad","fusser18",315,2,"ARD","dysgu o hynna felly yn_dydy","q","cym","monoW","ww",0,3,1,1,1,1,3,2,1,1,1,1,1,1,1
"Siarad","fusser18",322,1,"ARD","mi oedd yn_doedd",,"cym","monoW","ww",0,3,1,1,1,1,3,2,1,1,1,1,1,1,1
"Siarad","fusser18",520,1,"ARD","so mae yn eistedd",,"cym","monoW","ww",0,3,1,1,1,1,3,2,1,1,1,1,1,1,1
"Siarad","fusser18",521,1,"BEU","so mae hi wedi penderfynu",,"cym","monoW","ww",1,1,1,1,1,3,2,2.5,1,1,1,1,4,4,2.2
"Siarad","fusser18",521,2,"BEU","pwy mae isio eistedd",,"cym","monoW","ww",1,1,1,1,1,3,2,2.5,1,1,1,1,4,4,2.2
"Siarad","fusser18",523,1,"BEU","mae Cai ddim isio eistedd wrth ymyl y ffenestr hefyd",,"cym","monoW","ww",1,1,1,1,1,3,2,2.5,1,1,1,1,4,4,2.2
"Siarad","fusser18",526,1,"ARD","a wedyn dan ni mynd i fynd hefo nhw felly",,"cym","monoW","ww",0,3,1,1,1,1,3,2,1,1,1,1,1,1,1
"Siarad","fusser18",526,2,"ARD","i fynd hefo nhw felly","q","cym","monoW","ww",0,3,1,1,1,1,3,2,1,1,1,1,1,1,1
"Siarad","fusser18",527,1,"BEU","oh fydd raid ni fynd efo nhw",,"cym","monoW","ww",1,1,1,1,1,3,2,2.5,1,1,1,1,4,4,2.2
"Siarad","fusser18",529,1,"BEU","yndyn",,"cym","monoW","ww",1,1,1,1,1,3,2,2.5,1,1,1,1,4,4,2.2
"Siarad","fusser18",532,1,"BEU","oh wneith change cael",,"cym","monoW","ww",1,1,1,1,1,3,2,2.5,1,1,1,1,4,4,2.2
"Siarad","fusser18",532,2,"BEU","mynd lle dreifio ar_hyd yr A_pum_deg_pump",,"cym","monoW","ww",1,1,1,1,1,3,2,2.5,1,1,1,1,4,4,2.2
"Siarad","fusser18",533,1,"ARD","ges i",,"cym","monoW","ww",0,3,1,1,1,1,3,2,1,1,1,1,1,1,1
"Siarad","fusser18",533,2,"ARD","fynd ar bus wsnos dwytha",,"cym","monoW","ww",0,3,1,1,1,1,3,2,1,1,1,1,1,1,1
"Siarad","fusser18",534,1,"ARD","oedd yna um er gwmni yn um rhoi",,"cym","monoW","ww",0,3,1,1,1,1,3,2,1,1,1,1,1,1,1
"Siarad","fusser18",535,1,"ARD","well be oedd y y title",,"cym","monoW","ww",0,3,1,1,1,1,3,2,1,1,1,1,1,1,1
"Siarad","fusser18",535,2,"ARD","oedd um Pills_Thrills_and_Automobiles",,"cym","biling","wb",0,3,1,1,1,1,3,2,1,1,1,1,1,1,1
"Siarad","fusser18",539,1,"ARD","ac oedden nhw er wedi cael eu comisiynu gyn y cyngor sir i fynd round ysgolion er chweched dosbarth",,"cym","monoW","ww",0,3,1,1,1,1,3,2,1,1,1,1,1,1,1
"Siarad","fusser18",539,2,"ARD","eu comisiynu gyn y cyngor sir","q","cym","monoW","ww",0,3,1,1,1,1,3,2,1,1,1,1,1,1,1
"Siarad","fusser18",539,3,"ARD","i fynd round ysgolion er chweched dosbarth","q","cym","monoW","ww",0,3,1,1,1,1,3,2,1,1,1,1,1,1,1
"Siarad","fusser18",540,1,"ARD","a a Coleg_Meirion_Dwyfor oedd un",,"cym","monoW","ww",0,3,1,1,1,1,3,2,1,1,1,1,1,1,1
"Siarad","fusser18",541,1,"ARD","so aethon ni â tair bus mynd â er myfyrwyr i_fyny yna",,"cym","monoW","ww",0,3,1,1,1,1,3,2,1,1,1,1,1,1,1
"Siarad","fusser18",541,2,"ARD","â tair bus mynd â er myfyrwyr i_fyny yna","q","cym","monoW","ww",0,3,1,1,1,1,3,2,1,1,1,1,1,1,1
"Siarad","fusser18",542,1,"ARD","oedd o yn dda",,"cym","monoW","ww",0,3,1,1,1,1,3,2,1,1,1,1,1,1,1
"Siarad","fusser18",543,1,"ARD","oedd y safon yn dda",,"cym","monoW","ww",0,3,1,1,1,1,3,2,1,1,1,1,1,1,1
"Siarad","fusser18",544,1,"BEU","be be oedd yn trio wneud","clause division","cym","monoW","ww",1,1,1,1,1,3,2,2.5,1,1,1,1,4,4,2.2
"Siarad","fusser18",544,2,"BEU","wneud","q","cym","monoW","ww",1,1,1,1,1,3,2,2.5,1,1,1,1,4,4,2.2
"Siarad","fusser18",569,1,"BEU","mae rei o nhw yr oedran yna medru bod yn wyllt i chi yn_does",,"cym","monoW","ww",1,1,1,1,1,3,2,2.5,1,1,1,1,4,4,2.2
"Siarad","fusser18",577,1,"BEU","dw i ddim yn gwybod",,"cym","monoW","ww",1,1,1,1,1,3,2,2.5,1,1,1,1,4,4,2.2
"Siarad","fusser18",583,1,"BEU","dyna ydy peth gorau","non-finite",,"monoW",,1,1,1,1,1,3,2,2.5,1,1,1,1,4,4,2.2
"Siarad","fusser18",583,2,"BEU","ydy peth gorau","q","cym","monoW","ww",1,1,1,1,1,3,2,2.5,1,1,1,1,4,4,2.2
"Siarad","fusser18",586,1,"BEU","oes o'ch chdi yn deud",,"cym","monoW","ww",1,1,1,1,1,3,2,2.5,1,1,1,1,4,4,2.2
"Siarad","fusser18",789,1,"ARD","dw ddim gwybod lle lle",,"cym","monoW","ww",0,3,1,1,1,1,3,2,1,1,1,1,1,1,1
"Siarad","fusser18",789,2,"ARD","lle awn ni",,"cym","monoW","ww",0,3,1,1,1,1,3,2,1,1,1,1,1,1,1
"Siarad","fusser18",792,1,"BEU","ia mae haws wneud hynny yn car wash",,"cym","biling","wb",1,1,1,1,1,3,2,2.5,1,1,1,1,4,4,2.2
"Siarad","fusser18",793,1,"BEU","ond wna i","x","cym","monoW","ww",1,1,1,1,1,3,2,2.5,1,1,1,1,4,4,2.2
"Siarad","fusser18",793,2,"BEU","wna i roid y stuff ar dy ar ar alloy wheels","clause division","cym","biling","wb",1,1,1,1,1,3,2,2.5,1,1,1,1,4,4,2.2
"Siarad","fusser18",793,3,"BEU","roid y stuff ar dy ar ar alloy wheels","q","cym","biling","wb",1,1,1,1,1,3,2,2.5,1,1,1,1,4,4,2.2
"Siarad","fusser18",794,1,"ARD","oh ia because mae nhw ddu",,"cym","biling","wb",0,3,1,1,1,1,3,2,1,1,1,1,1,1,1
"Siarad","fusser18",796,1,"BEU","er mae hynna mynd i gael y stuff er",,"cym","monoW","ww",1,1,1,1,1,3,2,2.5,1,1,1,1,4,4,2.2
"Siarad","fusser18",796,2,"BEU","i gael y stuff er","q","cym","monoW","ww",1,1,1,1,1,3,2,2.5,1,1,1,1,4,4,2.2
"Siarad","fusser18",798,1,"BEU","mae gael y break fluid off",,"cym","biling","wb",1,1,1,1,1,3,2,2.5,1,1,1,1,4,4,2.2
"Siarad","fusser18",798,2,"BEU","yndy",,"cym","monoW","ww",1,1,1,1,1,3,2,2.5,1,1,1,1,4,4,2.2
"Siarad","fusser18",799,1,"ARD","y break fluid off yndy",,"cym","biling","wb",0,3,1,1,1,1,3,2,1,1,1,1,1,1,1
"Siarad","fusser18",799,2,"ARD","ydy",,"cym","monoW","ww",0,3,1,1,1,1,3,2,1,1,1,1,1,1,1
"Siarad","fusser18",800,1,"ARD","a dan ni isio service i ceir hefyd yn_does",,"cym","biling","wb",0,3,1,1,1,1,3,2,1,1,1,1,1,1,1
"Siarad","fusser18",801,1,"BEU","mae yr ddau car isio service",,"cym","biling","wb",1,1,1,1,1,3,2,2.5,1,1,1,1,4,4,2.2
"Siarad","fusser18",802,1,"ARD","service oes",,"cym","biling","wb",0,3,1,1,1,1,3,2,1,1,1,1,1,1,1
"Siarad","fusser18",809,1,"BEU","alla i fynd â nhw ar y ffordd i gwaith",,"cym","monoW","ww",1,1,1,1,1,3,2,2.5,1,1,1,1,4,4,2.2
"Siarad","fusser18",814,1,"BEU","dyna baswn i yn gobeithio","non-finite",,"monoW",,1,1,1,1,1,3,2,2.5,1,1,1,1,4,4,2.2
"Siarad","fusser18",814,2,"BEU","baswn i","x","cym","monoW","ww",1,1,1,1,1,3,2,2.5,1,1,1,1,4,4,2.2
"Siarad","fusser18",814,3,"BEU","baswn i yn gobeithio","q","cym","monoW","ww",1,1,1,1,1,3,2,2.5,1,1,1,1,4,4,2.2
"Siarad","fusser18",816,1,"BEU","ond wna i","x","cym","monoW","ww",1,1,1,1,1,3,2,2.5,1,1,1,1,4,4,2.2
"Siarad","fusser18",816,2,"BEU","wna i siarad efo nhw",,"cym","monoW","ww",1,1,1,1,1,3,2,2.5,1,1,1,1,4,4,2.2
"Siarad","fusser18",818,1,"BEU","wna i wneud trio bwcio rywbeth fory",,"cym","monoW","ww",1,1,1,1,1,3,2,2.5,1,1,1,1,4,4,2.2
"Siarad","fusser18",818,2,"BEU","trio","q","cym","monoW","ww",1,1,1,1,1,3,2,2.5,1,1,1,1,4,4,2.2
"Siarad","fusser18",818,3,"BEU","bwcio rywbeth fory","q","cym","monoW","ww",1,1,1,1,1,3,2,2.5,1,1,1,1,4,4,2.2
"Siarad","fusser18",822,1,"BEU","sut dan ni o ran bwyd wythnos yma",,"cym","monoW","ww",1,1,1,1,1,3,2,2.5,1,1,1,1,4,4,2.2
"Siarad","fusser18",823,1,"ARD","oh dan ni yn iawn",,"cym","monoW","ww",0,3,1,1,1,1,3,2,1,1,1,1,1,1,1
"Siarad","fusser18",827,1,"ARD","tra fyddwch chi yn judo a i wneud siopa gael yr um y basics","clause division","cym","monoW","ww",0,3,1,1,1,1,3,2,1,1,1,1,1,1,1
"Siarad","fusser18",827,2,"ARD","siopa","q","cym","monoW","ww",0,3,1,1,1,1,3,2,1,1,1,1,1,1,1
"Siarad","fusser18",827,3,"ARD","gael yr um y basics","q","cym","biling","wb",0,3,1,1,1,1,3,2,1,1,1,1,1,1,1
"Siarad","fusser18",829,1,"ARD","wnaeth Haf a fi fwynhau mynd neithiwr i siopa ar nos Sadwrn Tesco",,"cym","monoW","ww",0,3,1,1,1,1,3,2,1,1,1,1,1,1,1
"Siarad","fusser18",829,2,"ARD","fwynhau","x","cym","monoW","ww",0,3,1,1,1,1,3,2,1,1,1,1,1,1,1
"Siarad","fusser18",829,3,"ARD","mynd neithiwr","q","cym","monoW","ww",0,3,1,1,1,1,3,2,1,1,1,1,1,1,1
"Siarad","fusser18",829,4,"ARD","i siopa ar nos Sadwrn Tesco","q","cym","monoW","ww",0,3,1,1,1,1,3,2,1,1,1,1,1,1,1
"Siarad","fusser18",831,1,"ARD","oedd hi yn dawel braf yna",,"cym","monoW","ww",0,3,1,1,1,1,3,2,1,1,1,1,1,1,1
"Siarad","fusser18",833,1,"ARD","ac oedd just cael ryw luxuries bach felly ar_gyfer nos Sadwrn a penwythnos a wedyn gwneud y basics",,"cym","biling","wb",0,3,1,1,1,1,3,2,1,1,1,1,1,1,1
"Siarad","fusser18",833,2,"ARD","gwneud y basics","q","cym","biling","wb",0,3,1,1,1,1,3,2,1,1,1,1,1,1,1
"Siarad","fusser18",833,3,"ARD","dw meddwl ar nos Fawrth",,"cym","monoW","ww",0,3,1,1,1,1,3,2,1,1,1,1,1,1,1
"Siarad","fusser19",228,1,"TRE","ond wedi deud hynny mae yna bethau fel er helplines ar y phone a peth felly toes","q","cym","monoW","ww",1,2,3,1,2,3,2,2.5,1,1,1,1,1,1,1
"Siarad","fusser19",228,2,"TRE","mae yna bethau fel er helplines ar y phone a peth felly toes",,"cym","biling","wb",1,2,3,1,2,3,2,2.5,1,1,1,1,1,1,1
"Siarad","fusser19",234,1,"OLW","nag ydy rai pobl",,"cym","monoW","ww",1,2,1,1,1,1,1,1,1,1,1,4,1,4,2.2
"Siarad","fusser19",235,1,"TRE","yeah yeah ond er gynta byd mae nhw yn weld o am",,"cym","monoW","ww",1,2,3,1,2,3,2,2.5,1,1,1,1,1,1,1
"Siarad","fusser19",235,2,"TRE","be ydy o",,"cym","monoW","ww",1,2,3,1,2,3,2,2.5,1,1,1,1,1,1,1
"Siarad","fusser19",236,1,"TRE","mae nhw hanner ffordd",,"cym","monoW","ww",1,2,3,1,2,3,2,2.5,1,1,1,1,1,1,1
"Siarad","fusser19",238,1,"OLW","mae yr government yn um stopio gael cafes a yr pubs yma a stop",,"cym","biling","wb",1,2,1,1,1,1,1,1,1,1,1,4,1,4,2.2
"Siarad","fusser19",239,1,"OLW","mae nhw mynd i trio","clause division","cym","monoW","ww",1,2,1,1,1,1,1,1,1,1,1,4,1,4,2.2
"Siarad","fusser19",239,2,"OLW","i trio","q","cym","monoW","ww",1,2,1,1,1,1,1,1,1,1,1,4,1,4,2.2
"Siarad","fusser19",239,3,"OLW","gael cafes a yr pubs yma a stop","q","cym","monoW","ww",1,2,1,1,1,1,1,1,1,1,1,4,1,4,2.2
"Siarad","fusser19",240,1,"OLW","dim smocio","x","cym","monoW","ww",1,2,1,1,1,1,1,1,1,1,1,4,1,4,2.2
"Siarad","fusser19",240,2,"OLW","dydy","x","cym","monoW","ww",1,2,1,1,1,1,1,1,1,1,1,4,1,4,2.2
"Siarad","fusser19",243,1,"OLW","mae nhw","x","cym","monoW","ww",1,2,1,1,1,1,1,1,1,1,1,4,1,4,2.2
"Siarad","fusser19",243,2,"OLW","na mae nhw mynd i trio wneud o fan yma hefyd","clause division","cym","monoW","ww",1,2,1,1,1,1,1,1,1,1,1,4,1,4,2.2
"Siarad","fusser19",243,3,"OLW","i trio","q","cym","monoW","ww",1,2,1,1,1,1,1,1,1,1,1,4,1,4,2.2
"Siarad","fusser19",243,4,"OLW","wneud o fan yma hefyd","q","cym","monoW","ww",1,2,1,1,1,1,1,1,1,1,1,4,1,4,2.2
"Siarad","fusser19",244,1,"TRE","oh ia rywbeth arall ydy hynna",,"cym","monoW","ww",1,2,3,1,2,3,2,2.5,1,1,1,1,1,1,1
"Siarad","fusser19",245,1,"TRE","mae nhw deud Lloegr",,"cym","monoW","ww",1,2,3,1,2,3,2,2.5,1,1,1,1,1,1,1
"Siarad","fusser19",247,1,"TRE","Lloegr sy wedi pasio deddf",,"cym","monoW","ww",1,2,3,1,2,3,2,2.5,1,1,1,1,1,1,1
"Siarad","fusser19",250,1,"OLW","ond mae nhw mynd i drio fo fan yma",,"cym","monoW","ww",1,2,1,1,1,1,1,1,1,1,1,4,1,4,2.2
"Siarad","fusser19",250,2,"OLW","i drio fo fan yma","q","cym","monoW","ww",1,2,1,1,1,1,1,1,1,1,1,4,1,4,2.2
"Siarad","fusser19",251,1,"TRE","oh dw i yn gwybod",,"cym","monoW","ww",1,2,3,1,2,3,2,2.5,1,1,1,1,1,1,1
"Siarad","fusser19",252,1,"OLW","mae hynna beth da",,"cym","monoW","ww",1,2,1,1,1,1,1,1,1,1,1,4,1,4,2.2
"Siarad","fusser19",252,2,"OLW","dydy","x","cym","monoW","ww",1,2,1,1,1,1,1,1,1,1,1,4,1,4,2.2
"Siarad","fusser19",253,1,"TRE","os ydy y Cynulliad yn ei basio de",,"cym","monoW","ww",1,2,3,1,2,3,2,2.5,1,1,1,1,1,1,1
"Siarad","fusser19",255,1,"OLW","dw i meddwl",,"cym","monoW","ww",1,2,1,1,1,1,1,1,1,1,1,4,1,4,2.2
"Siarad","fusser19",255,2,"OLW","fod o yn idea da fy hun de",,"cym","monoW","ww",1,2,1,1,1,1,1,1,1,1,1,4,1,4,2.2
"Siarad","fusser19",257,1,"OLW","a pawb gwneud be bynnag",,"cym","monoW","ww",1,2,1,1,1,1,1,1,1,1,1,4,1,4,2.2
"Siarad","fusser19",257,2,"OLW","mae nhw isio adre neu rywbeth de",,"cym","monoW","ww",1,2,1,1,1,1,1,1,1,1,1,4,1,4,2.2
"Siarad","fusser19",259,1,"OLW","os mae nhw isio smocio adre",,"cym","monoW","ww",1,2,1,1,1,1,1,1,1,1,1,4,1,4,2.2
"Siarad","fusser19",259,2,"OLW","geith nhw",,"cym","monoW","ww",1,2,1,1,1,1,1,1,1,1,1,4,1,4,2.2
"Siarad","fusser19",261,1,"TRE","gwneud o weithio ydy peth","non-finite","cym","monoW","ww",1,2,3,1,2,3,2,2.5,1,1,1,1,1,1,1
"Siarad","fusser19",261,2,"TRE","o weithio","q","cym","monoW","ww",1,2,3,1,2,3,2,2.5,1,1,1,1,1,1,1
"Siarad","fusser19",261,3,"TRE","ydy peth","q","cym","monoW","ww",1,2,3,1,2,3,2,2.5,1,1,1,1,1,1,1
"Siarad","fusser19",262,1,"TRE","mae wedi gweithio yn Iwerddon do",,"cym","monoW","ww",1,2,3,1,2,3,2,2.5,1,1,1,1,1,1,1
"Siarad","fusser19",479,1,"TRE","yndy",,"cym","monoW","ww",1,2,3,1,2,3,2,2.5,1,1,1,1,1,1,1
"Siarad","fusser19",479,2,"TRE","ydy",,"cym","monoW","ww",1,2,3,1,2,3,2,2.5,1,1,1,1,1,1,1
"Siarad","fusser19",479,3,"TRE","mae yn wir",,"cym","monoW","ww",1,2,3,1,2,3,2,2.5,1,1,1,1,1,1,1
"Siarad","fusser19",481,1,"OLW","mae",,"cym","monoW","ww",1,2,1,1,1,1,1,1,1,1,1,4,1,4,2.2
"Siarad","fusser19",481,2,"OLW","mae yna rules",,"cym","biling","wb",1,2,1,1,1,1,1,1,1,1,1,4,1,4,2.2
"Siarad","fusser19",482,1,"OLW","a ac ar diwedd diwrnod y rheswm mae nhw yn trio dod â yr rule yma i_fewn",,"cym","biling","wb",1,2,1,1,1,1,1,1,1,1,1,4,1,4,2.2
"Siarad","fusser19",482,2,"OLW","dod â yr rule yma i_fewn","q","cym","biling","wb",1,2,1,1,1,1,1,1,1,1,1,4,1,4,2.2
"Siarad","fusser19",482,3,"OLW","ydy am bod yn effeithio pobl eraill a",,"cym","monoW","ww",1,2,1,1,1,1,1,1,1,1,1,4,1,4,2.2
"Siarad","fusser19",484,1,"TRE","dw i ddim yn deud",,"cym","monoW","ww",1,2,3,1,2,3,2,2.5,1,1,1,1,1,1,1
"Siarad","fusser19",485,1,"TRE","dw i ddim yn deud",,"cym","monoW","ww",1,2,3,1,2,3,2,2.5,1,1,1,1,1,1,1
"Siarad","fusser19",487,1,"TRE","deud wrtha chdi be ydy dadl Forest","non-finite","cym","monoW","ww",1,2,3,1,2,3,2,2.5,1,1,1,1,1,1,1
"Siarad","fusser19",487,2,"TRE","be ydy dadl Forest","q","cym","monoW","ww",1,2,3,1,2,3,2,2.5,1,1,1,1,1,1,1
"Siarad","fusser19",487,3,"TRE","ydw i",,"cym","monoW","ww",1,2,3,1,2,3,2,2.5,1,1,1,1,1,1,1
"Siarad","fusser19",488,1,"OLW","ond mae dadl nhw",,"cym","monoW","ww",1,2,1,1,1,1,1,1,1,1,1,4,1,4,2.2
"Siarad","fusser19",489,1,"OLW","gennyn nhw ddim coes da i sefyll ar","non-finite","cym","monoW","ww",1,2,1,1,1,1,1,1,1,1,1,4,1,4,2.2
"Siarad","fusser19",489,2,"OLW","nag oes","x","cym","monoW","ww",1,2,1,1,1,1,1,1,1,1,1,4,1,4,2.2
"Siarad","fusser19",491,1,"TRE","y ffaith ydy",,"cym","monoW","ww",1,2,3,1,2,3,2,2.5,1,1,1,1,1,1,1
"Siarad","fusser19",491,2,"TRE","dyna","x",,"monoW",,1,2,3,1,2,3,2,2.5,1,1,1,1,1,1,1
"Siarad","fusser19",492,1,"OLW","oh dim fi ydy yr government",,"cym","biling","wb",1,2,1,1,1,1,1,1,1,1,1,4,1,4,2.2
"Siarad","fusser19",495,1,"TRE","na dw innau ddim yn cymryd eu ochr nhw",,"cym","monoW","ww",1,2,3,1,2,3,2,2.5,1,1,1,1,1,1,1
"Siarad","fusser19",496,1,"OLW","oh chdi sy wedi dod â nhw fyny",,"cym","monoW","ww",1,2,1,1,1,1,1,1,1,1,1,4,1,4,2.2
"Siarad","fusser19",497,1,"TRE","yeah yeah ond cymryd ei hochr nhw o ran deud ydw i","non-finite","cym","monoW","ww",1,2,3,1,2,3,2,2.5,1,1,1,1,1,1,1
"Siarad","fusser19",497,2,"TRE","ydw i","q","cym","monoW","ww",1,2,3,1,2,3,2,2.5,1,1,1,1,1,1,1
"Siarad","fusser19",498,1,"TRE","mai dyna be ydy dadl nhw","non-finite","cym","monoW","ww",1,2,3,1,2,3,2,2.5,1,1,1,1,1,1,1
"Siarad","fusser19",498,2,"TRE","be ydy dadl nhw","q","cym","monoW","ww",1,2,3,1,2,3,2,2.5,1,1,1,1,1,1,1
"Siarad","fusser19",499,1,"TRE","mae gen bawb ei hawl ei hun i fwynhau ei hun ffordd",,"cym","monoW","ww",1,2,3,1,2,3,2,2.5,1,1,1,1,1,1,1
"Siarad","fusser19",499,2,"TRE","ei hun","q","cym","monoW","ww",1,2,3,1,2,3,2,2.5,1,1,1,1,1,1,1
"Siarad","fusser19",499,3,"TRE","i fwynhau ei hun ffordd","q","cym","monoW","ww",1,2,3,1,2,3,2,2.5,1,1,1,1,1,1,1
"Siarad","fusser19",499,4,"TRE","mae nhw isio",,"cym","monoW","ww",1,2,3,1,2,3,2,2.5,1,1,1,1,1,1,1
"Siarad","fusser19",500,1,"OLW","oes",,"cym","monoW","ww",1,2,1,1,1,1,1,1,1,1,1,4,1,4,2.2
"Siarad","fusser19",502,1,"OLW","oes ond",,"cym","monoW","ww",1,2,1,1,1,1,1,1,1,1,1,4,1,4,2.2
"Siarad","fusser19",502,2,"OLW","os ydy o yn effeithio pobl eraill a roid niwed iddyn nhw",,"cym","monoW","ww",1,2,1,1,1,1,1,1,1,1,1,4,1,4,2.2
"Siarad","fusser19",502,3,"OLW","a roid niwed iddyn nhw","q","cym","monoW","ww",1,2,1,1,1,1,1,1,1,1,1,4,1,4,2.2
"Siarad","fusser19",502,4,"OLW","dw i","x","cym","monoW","ww",1,2,1,1,1,1,1,1,1,1,1,4,1,4,2.2
"Siarad","fusser19",502,5,"OLW","dw i yn anghytuno",,"cym","monoW","ww",1,2,1,1,1,1,1,1,1,1,1,4,1,4,2.2
"Siarad","fusser19",505,1,"OLW","mae",,"cym","monoW","ww",1,2,1,1,1,1,1,1,1,1,1,4,1,4,2.2
"Siarad","fusser19",509,1,"TRE","dw i wedi",,"cym","monoW","ww",1,2,3,1,2,3,2,2.5,1,1,1,1,1,1,1
"Siarad","fusser19",524,1,"OLW","oh dw i yn gofyn",,"cym","monoW","ww",1,2,1,1,1,1,1,1,1,1,1,4,1,4,2.2
"Siarad","fusser19",712,1,"TRE","ond y ffaith ydy",,"cym","monoW","ww",1,2,3,1,2,3,2,2.5,1,1,1,1,1,1,1
"Siarad","fusser19",712,2,"TRE","does yna ddim rhaid cael gwybod",,"cym","monoW","ww",1,2,3,1,2,3,2,2.5,1,1,1,1,1,1,1
"Siarad","fusser19",712,3,"TRE","gwybod am","q","cym","monoW","ww",1,2,3,1,2,3,2,2.5,1,1,1,1,1,1,1
"Siarad","fusser19",712,4,"TRE","am be sy yn digwydd yn y byd",,"cym","monoW","ww",1,2,3,1,2,3,2,2.5,1,1,1,1,1,1,1
"Siarad","fusser19",713,1,"TRE","disturbance of the mind ydy o",,"cym","biling","wb",1,2,3,1,2,3,2,2.5,1,1,1,1,1,1,1
"Siarad","fusser19",714,1,"TRE","os wyt ti yn cael gwybod bod yna er rywbeth ryw earthquake wedi digwydd yn y Phillipines",,"cym","biling","wb",1,2,3,1,2,3,2,2.5,1,1,1,1,1,1,1
"Siarad","fusser19",714,2,"TRE","gwybod","q","cym","monoW","ww",1,2,3,1,2,3,2,2.5,1,1,1,1,1,1,1
"Siarad","fusser19",714,3,"TRE","bod yna er rywbeth ryw earthquake wedi digwydd yn y Phillipines","q","cym","biling","wb",1,2,3,1,2,3,2,2.5,1,1,1,1,1,1,1
"Siarad","fusser19",720,1,"TRE","ond ffaith ydy",,"cym","monoW","ww",1,2,3,1,2,3,2,2.5,1,1,1,1,1,1,1
"Siarad","fusser19",720,2,"TRE","doedd neb yn prepared am New_Orleans","clause division","cym","biling","wb",1,2,3,1,2,3,2,2.5,1,1,1,1,1,1,1
"Siarad","fusser19",720,3,"TRE","nag oedd","x","cym","monoW","ww",1,2,3,1,2,3,2,2.5,1,1,1,1,1,1,1
"Siarad","fusser19",721,1,"TRE","er gymaint o newyddion oedd o_gwmpas",,"cym","monoW","ww",1,2,3,1,2,3,2,2.5,1,1,1,1,1,1,1
"Siarad","fusser19",731,1,"OLW","mae rhan fwya o newyddion",,"cym","monoW","ww",1,2,1,1,1,1,1,1,1,1,1,4,1,4,2.2
"Siarad","fusser19",732,1,"OLW","mae nhw yn pigo pethau fyny ar y radar ac ar y satellite a pethau",,"cym","biling","wb",1,2,1,1,1,1,1,1,1,1,1,4,1,4,2.2
"Siarad","fusser19",733,1,"OLW","a mae nhw yn gallu roid warning i bobl",,"cym","monoW","ww",1,2,1,1,1,1,1,1,1,1,1,4,1,4,2.2
"Siarad","fusser19",733,2,"OLW","roid warning i bobl","q","cym","monoW","ww",1,2,1,1,1,1,1,1,1,1,1,4,1,4,2.2
"Siarad","fusser19",736,1,"OLW","mae hwnna just yn freak case hynna bod bod",,"cym","biling","wb",1,2,1,1,1,1,1,1,1,1,1,4,1,4,2.2
"Siarad","fusser19",738,1,"OLW","unexplained pam wnaeth o ddigwydd",,"cym","biling","wb",1,2,1,1,1,1,1,1,1,1,1,4,1,4,2.2
"Siarad","fusser19",740,1,"OLW","a pam oedden nhw ddim yn gwybod",,"cym","monoW","ww",1,2,1,1,1,1,1,1,1,1,1,4,1,4,2.2
"Siarad","fusser19",741,1,"OLW","mae hynna just yn unexplained",,"cym","biling","wb",1,2,1,1,1,1,1,1,1,1,1,4,1,4,2.2
"Siarad","fusser19",742,1,"OLW","fedri di ddim iwsio rywbeth fel yna",,"cym","monoW","ww",1,2,1,1,1,1,1,1,1,1,1,4,1,4,2.2
"Siarad","fusser19",743,1,"OLW","achos ydan ni ddim yn gael",,"cym","monoW","ww",1,2,1,1,1,1,1,1,1,1,1,4,1,4,2.2
"Siarad","fusser19",743,2,"OLW","llwythi o pethau fel yna yn digwydd on a daily basis","non-finite","cym","biling","wb",1,2,1,1,1,1,1,1,1,1,1,4,1,4,2.2
"Siarad","fusser19",743,3,"OLW","yn digwydd on a daily basis","q","cym","biling","wb",1,2,1,1,1,1,1,1,1,1,1,4,1,4,2.2
"Siarad","fusser19",744,1,"TRE","dw i ddim yn dallt",,"cym","monoW","ww",1,2,3,1,2,3,2,2.5,1,1,1,1,1,1,1
